<?xml version="1.0" encoding="UTF-8" standalone="no"?>
<entity xmlns:vc="http://www.w3.org/2007/XMLSchema-versioning" xmlns:xsi="http://www.w3.org/2001/XMLSchema-instance" xsi:noNamespaceSchemaLocation="ses.xsd" name="Scenario">
<aspect name="scenarioDec">
<entity name="Environment">
<aspect name="envDec">
<entity name="Summer_Season">
</entity>
<entity name="Noon_TimeOfDay">
</entity>
</aspect>
</entity>
<entity name="EgoAC">
<var name="Latitude" default="64" lower="63.7" upper="65" ></var>
<var name="Longitude" default="-22.60" lower="-22.65" upper="-21.50" ></var>
<var name="Altitude" default="1500" lower="1400" upper="1600" ></var>
<var name="Plane_Distance" default="none" lower="100" upper="600" ></var>
<var name="Roll" default="none" lower="-30" upper="30" ></var>
<var name="Pitch" default="none" lower="-30" upper="30" ></var>
<var name="Yaw" default="none" lower="0" upper="360" ></var>
</entity>
<entity name="B737_300_IntruderAC">
<var name="Latitude" default="none" lower="63.7" upper="65" ></var>
<var name="Longitude" default="none" lower="-22.6" upper="-21.5" ></var>
<var name="Altitude" default="none" lower="700" upper="1300" ></var>
</entity>
</aspect>
</entity>
